{
  "schema_version": 1,
  "run_id": "fixture-warm-localized-fix-1",
  "scenario": "warm_localized_fix",
  "mode": "warm_repository",
  "repository_revision": "fixture",
  "platform": "linux-x86_64",
  "machine": {"cpu": "fixture", "memory_bytes": 8589934592, "os": "linux"},
  "provider": {"mode": "deterministic_fixture", "route": "local"},
  "outcome": {"status": "success", "verified_success": true, "first_pass_verified_success": true},
  "phases": {"objective_accepted_ns": 1000000000, "first_action_ns": 1100000000, "verification_started_ns": 1800000000, "verified_completion_ns": 2000000000},
  "model": {"requests": 2, "tokens": 1200, "retries": 0, "cache_eligible": 1, "cache_hits": 1},
  "tools": {"calls": 10, "redundant_calls": 0, "failures": 0, "cancelled": 0},
  "verification": {"coverage": 1.0, "started_ns": 1800000000, "completed_ns": 2000000000, "failures": 0, "reruns": 0},
  "artifacts": ["result.json", "timeline.json"]
}
